{
  "$schema": "https://schemas.aoa.local/models/model-identity.schema.json",
  "schema_version": "aoa_model_identity_v1",
  "kind": "ModelIdentity",
  "model_identity_id": "model-identity:openai/gpt-5.6-sol",
  "provider": "OpenAI",
  "family": "GPT-5.6",
  "variant": "Sol",
  "version": "gpt-5.6-sol",
  "snapshot": null,
  "aliases": [
    "GPT-5.6 Sol",
    "gpt-5.6-sol"
  ],
  "status": "active",
  "source_refs": [
    {
      "source_id": "openai-codex-model-guidance-2026-08-01",
      "kind": "official_documentation",
      "uri": "https://learn.chatgpt.com/docs/models",
      "observed_at": "2026-08-01T07:44:16Z",
      "content_digest": null,
      "notes": "Current Codex guidance identifies Sol as the frontier model for the hardest agentic coding work."
    },
    {
      "source_id": "local-codex-model-catalog-sol-2026-08-01",
      "kind": "live_runtime_output",
      "uri": "command:codex-debug-models#gpt-5.6-sol",
      "observed_at": "2026-08-01T07:44:16Z",
      "content_digest": null,
      "notes": "Codex CLI 0.146.0 exposes slug gpt-5.6-sol, context 272000, effective context 95 percent, API support, and multi-agent backend v2."
    }
  ],
  "created_at": "2026-08-01T07:44:16Z",
  "updated_at": "2026-08-01T07:44:16Z"
}
